Identifier,Title,Description,Award Date,Amount Awarded,Funding Org:Identifier,Funding Org:Name,DocumentWeight
360G-blf-0030090345,Community Forest School,"A project by this Stourport-on-Severn, Worcestershire school to set up a co-educational facility between themselves and Lickhill Primary School will provide woodland and outdoor educational activities to pupils of the schools.",2010-03-05,9984.0,360G-blf,The Big Lottery Fund,0.0322433864264
360G-blf-0030049174,Karate Programme,Monson Primary School will introduce karate as part of their after school programme.,2006-03-15,4700.0,360G-blf,The Big Lottery Fund,0.0322419495585
360G-blf-0030104031,There is no project name available for this record,"The school will offer a new cheerleading club for girls at the school and other schools in the cluster. This grant will fund pom poms, a portable PA system and cheerleading T-shirts.",2010-08-05,930.0,360G-blf,The Big Lottery Fund,0.0322381441396
360G-blf-0030057766,Going Green at Oakfield,"This school in Gateshead will use funding to develop the school grounds, including a 'grow your own' and biodiversity area. This will enable the school to run after school clubs focusing on growing your own and biodiversity.",2011-01-27,8470.0,360G-blf,The Big Lottery Fund,0.0322150557716
360G-blf-0030129906,St Josephs RC Primary School - Multi Use Games Area,"Funding will be used to provide an improved playground surface and markings and a storage unit at this primary school. The project will provide opportunities to learn and improve skills for 280 pupils at the school and 123 others from local schools. Sports to benefit include basketball, netball and Kwick cricket. Pupils will be able to engage in sports clubs before and after school. Both friendly and competitive games are planned for pupils at St Joseph's and between schools.",2004-06-21,17440.0,360G-blf,The Big Lottery Fund,0.032178495629
360G-blf-0030055564,Allen Edwards Primary School - Urban Gardening Programme,"This is a project by a primary school in Lambeth. The school will use the funding to develop an after-school community garden club and forest school for pupils. This will provide a learning facility, focusing on children's social and emotional development and enable them to better understand and respect the natural environment.",2012-04-26,9900.0,360G-blf,The Big Lottery Fund,0.0321690787144
360G-blf-0030055566,'Krazy Clubs' of Kirk Lagley,"This is a project by a school in Kirk Langley, Derbyshire. The school will use the funding to provide after school physical activity sessions. This will improve fitness levels and sense of well being in the beneficiaries.",2012-02-09,9997.0,360G-blf,The Big Lottery Fund,0.0321027381867
360G-blf-0031045212,Activate outdoors at Dodleston Primary School,"The funding will be used by a primary school to improve outdoor facilities at the school. This will include extending the playground, creating a role play area and an all-weather area. The project aims to enable the school to provide after school sports clubs, as well as opportunities for pupils to take part in exciting outdoor activities in order to improve their health and wellbeing.",2017-02-01T00:00:00+00:00,9830.0,360G-blf,The Big Lottery Fund,0.0320796425232
360G-blf-0030023036,Langbourne After School Sports Clubs,"This primary school will use funding to establish a Tae Kwon Do after-school club for all pupils, in order for more children to participate in physical activity.",2008-10-07,3240.0,360G-blf,The Big Lottery Fund,0.0320584587326
360G-blf-0030114868,Hawksmoor International Times,"This is a project by a school in Greenwich. The school will use the funding to set up an after school group for the children, through which they will develop and publish a school newsletter. This will develop the confidence and skills of the children, and increase wider awareness of issues and events that affect children in the school.",2013-05-02,9900.0,360G-blf,The Big Lottery Fund,0.0320571797445
360G-blf-0030071494,The Beehive,"This is a project by a school in Swindon, Wiltshire. The school will use the funding to carry out a renovation of a building which is on school grounds. This will enable the school to use the building for after school activities and open it up to the rest of the community for their activities and meetings.",2012-08-30,10000.0,360G-blf,The Big Lottery Fund,0.032044415084
360G-blf-0030058630,"Hallbankgate Village School, Nursery + Pre-School Playground Development Pr","This is a project by a school in Cumbria. They will use funding to develop the school grounds with a wildlife area, vegetable garden and play area for the benefit of the local community. They will also run after school activities such as sports and cookery clubs for children.",2011-02-10,10000.0,360G-blf,The Big Lottery Fund,0.0320438331762
360G-blf-0030004965,Before and after school club,"A project to set up a before and after school club to provide a range of activities for children at this primary school in Malvern, Worcestershire.",2008-01-21,6425.0,360G-blf,The Big Lottery Fund,0.03202497315
360G-blf-0030016417,Playpod lands on school playground!,"This is a project by a primary school in Walsall, West Midlands. The school will use funding to purchase a play pod to give children at the school and the wider community an important play facility. This will improve facilities at the school and will enable beneficiaries to take part in outdoor learning activities.",2012-03-22,10000.0,360G-blf,The Big Lottery Fund,0.0320210394344
360G-blf-0030015585,Culcrow i-pads for all,"The group are a primary school parent teacher association for Culcrow Primary School in Aghadowey, Coleraine. The project will purchase iPads for all generations and community groups who use the school building.",2013-07-04,10000.0,360G-blf,The Big Lottery Fund,0.0319977037593
360G-blf-0030060334,Lakespace,This is a project by a school in Tamworth. The school will use the funding to install a playground within school grounds for use by the entire community. This will provide the local community with access to a new facility.,2011-08-04,9400.0,360G-blf,The Big Lottery Fund,0.0319919394259
360G-blf-0030003626,Colney Heath Primary School - Mini Beast Wildlife Area,"Colney Heath Primary School will turn a plot of land within the school into a garden. This will be used by students as a learning area during school time and as a garden for family, friends and visitors after school and at weekends.",2008-02-22,4900.0,360G-blf,The Big Lottery Fund,0.0319249407194
360G-blf-0031006322,Springhill Primary School,The school will use the grant to create an outdoor education area for pupils and the wider community.,2014-03-24,7965.0,360G-blf,The Big Lottery Fund,0.0318863757342
360G-blf-0030051366,The New Dig Allotments,This is a project by a primary school in Bedworth. The school will use the funding to construct an allotment site within the school grounds for use by pupils and the local community. This will provide the entire community with access to a new facility.,2011-09-15,10000.0,360G-blf,The Big Lottery Fund,0.0318846210756
360G-blf-0031050239,St Joseph's Catholic Primary School - Better Beginnings.,The funding will be used by a primary school to install a sensory play area on the school grounds for pupils in the school to access outside of the school day. The project aims to support physical and mental development whilst helping children to improve their language and social skills.,2017-06-21,9970.0,360G-blf,The Big Lottery Fund,0.031864151731
360G-blf-0031041924,Learning from the Woods,This school will use the funding to carry out Forrest School activities for pupils outside of school hours.,2016-11-01T00:00:00+00:00,10000.0,360G-blf,The Big Lottery Fund,0.0318455421732
360G-blf-0030092329,Stephenson Sanctuary,This is a project by a school in Bedford. The school will use funding to install a summer house within the school grounds. This will provide a new place for various school and community activities.,2010-12-16,6748.0,360G-blf,The Big Lottery Fund,0.0318258202433
360G-blf-0030012568,GO-RIDE at Monks Park School,A project by this school in Horfield to extend access to their cycling club to encourage pupils to ride to school.,2009-03-31,10000.0,360G-blf,The Big Lottery Fund,0.0318100807261
360G-blf-0030092296,Playground Development Scheme,"This is a project by a school in Wakefield. The school will use funding to create an outdoor play and learning area, benefiting pupils of the school. This will enable the school to hold outdoor lessons and provide new play activities.",2010-11-04,10000.0,360G-blf,The Big Lottery Fund,0.031803838454
360G-blf-0030022404,North Walkden Primary School After School Club,"This primary school will use an award to set up after-hours sports clubs in cricket, netball, basketball, rounders, dance and gymnastics. The sessions will be held at the school and delivered by professionally qualified coaches. The school will also purchase sports equipment and a steel storage container so that the equipment can be securely stored. Once the after school sessions have been fully established open days and tournaments with other schools will be arranged.",2008-11-17,9980.0,360G-blf,The Big Lottery Fund,0.0317854936553
360G-blf-0030061982,TASK After-School Project,This is a project by a school in Greenwich. The school will use funding to run after-school sessions to develop pupils' problem solving and critical thinking skills. This will enable beneficiaries to explore different social issues and improve their self-confidence and communication and teamwork skills.,2011-03-17,9972.0,360G-blf,The Big Lottery Fund,0.0317641501908
360G-blf-0030092052,BJs Bandstand,"This is a project by a primary school in Walsall. The school will use the funding to invite local residents to design, prepare and construct a freestanding community pavilion area within the school grounds. This will create an improved outdoor area for use by members of the school and local community.",2010-09-09,10000.0,360G-blf,The Big Lottery Fund,0.0317532927819
360G-blf-0030074389,Southwood Primary School Community Play Equipment,The school will use the grant to build a trim trail in the school's playground for pupils and the local community.,2012-11-30,10000.0,360G-blf,The Big Lottery Fund,0.0317184142745
360G-blf-0031037125,Fun for All in the Sun ... & the Rain & the Wind & the Snow!,The school will use the funding to improve the outdoor area of the school providing an undercover shelter and a quiet seating area. This will enable the school to enhance the outdoor space at the school and be able to run more after school clubs.  ,2016-07-13T00:00:00+00:00,10000.0,360G-blf,The Big Lottery Fund,0.031686667656
360G-blf-0030041585,Planting an Orchard,This school will use funding to plant an orchid and build a bandstand in the school grounds. This will improve the schools outdoor space and the facility will be available for use by local groups.,2006-08-23,5000.0,360G-blf,The Big Lottery Fund,0.031683730952
360G-blf-0030070101,Kehelland School Minibus Project,"This is a project by a school in Kehelland, Cornwall. The school will use the funding to purchase a new 17 seated minibus to provide extracurricular opportunities for the school and transport pupils to after school educational events. This will enable the beneficiaries to participate and access educational activities which encourage and support learning and development.",2012-08-16,10000.0,360G-blf,The Big Lottery Fund,0.0316331346075
360G-blf-0030018263,'Allez Les Enfants' after school and holiday clubs,"This is a project by a school in Bunny, Nottinghamshire. The group will use the funding to run a programme of after-school physical activities for children.",2011-11-10,9998.0,360G-blf,The Big Lottery Fund,0.0316223914118
360G-blf-0031031285,After school dance mat club,This school will use the funding to purchase electronic dance mat equipment to set up an after school club for children. This will enable the school to provide an engaging after school activity to promote a more healthy lifestyle for children in the school and the local community.,2016-02-10T00:00:00+00:00,9940.0,360G-blf,The Big Lottery Fund,0.031622281743
360G-blf-0030054339,MUGA,This primary school in Eastbourne will install a covered exercise area and provide fitness equipment on school grounds for use by children at the school and wider community.,2012-03-08,9219.0,360G-blf,The Big Lottery Fund,0.0316176870341
360G-blf-0030091562,New ICT Suite for Rotherfield Pre-School and After-School Club,"This is a project by a registered charity in East Sussex. They will use the funding to purchase IT equipment for their pre-school and after school clubs. This will provide opportunities for children to learn IT skills prior to starting school and continue this learning as an extra-curricular activity, throughout primary school in a fun environment.",2010-05-27,9803.0,360G-blf,The Big Lottery Fund,0.0315491210942
360G-blf-0030071002,Fitzwilliam Primary,"This is a project by a primary school in Pontefract, West Yorkshire. The organisation will use funding to deliver a range of after school activities for children at the school. This will enable the school to provide after school care, supporting parents experiencing childcare difficulties.",2012-03-29,10000.0,360G-blf,The Big Lottery Fund,0.0315378008168
360G-blf-0030078279,Out of School Multi-Sports Club,The project is to establish out of school clubs at a primary school. The money is for coaching costs and equipment.,2008-05-19,4065.0,360G-blf,The Big Lottery Fund,0.0315341686794
360G-blf-0031031463,Wild Woods Forest School Club,This school will use the funding to purchase equipment to run a pilot project for Forest School learning for two schools in the area. This will enable the school to provide an outdoor learning experience after school to improve wellbeing and attainment outcomes.,2016-02-17T00:00:00+00:00,1071.0,360G-blf,The Big Lottery Fund,0.0315334019597
360G-blf-0031000775,Curricular Enhancement,"The project will introduce a Rugby School to 23 S1 pupils which will consist of three sessions per week, two during school time and one after school as well as starting up an after school dance club.",2013-11-01,1823.23,360G-blf,The Big Lottery Fund,0.0315238164499
360G-COOPGROUP-9671,Grant to Vision (Rossendale),"We would fund creative workshops, training events and school work, e.g. assemblies (primary schools) and lessons (secondary schools).",2017-11-29,2362.24,GB-COH-IP00525R,Co-operative Group,0.0315210854065
360G-blf-0030129587,St. Peters RC Junior and Infant School - New Multi Use Games Area,"Birmingham LEA will provide a multi use games area to increase its area of outdoor provision at St Peters Catholic Primary School. The facility will enable the school to deliver the aims to provide after school clubs, develop mini-tennis and build further links with the community. The project will benefit 200 school pupils, 200 other school pupils and 140 community visits.",2004-11-15,16604.0,360G-blf,The Big Lottery Fund,0.0315051222565
360G-blf-0030039702,Showcase of Creative Talent,The award will fund an after-school showcase of after-school talent.,2006-05-17,4980.0,360G-blf,The Big Lottery Fund,0.0314668400416
360G-blf-0030009208,Notre Dame After School Clubs,A project to run after-school sessions in sports that pupils do not normally have access to.,2006-12-08,4522.0,360G-blf,The Big Lottery Fund,0.0314660067286
360G-blf-0030127653,Milton Keynes  LEA - Shepherdswell First School,"The project will provide laptops for use at five schools, with the aim of increasing computing access among pupils",2004-11-11,55050.0,360G-blf,The Big Lottery Fund,0.0314608077071
360G-blf-0030061422,Preston's Protected Plot,This is a project by a primary school in Norwich. The group will use funding to create a wildlife area in the school garden.,2011-03-04,2000.0,360G-blf,The Big Lottery Fund,0.0314478152022
360G-blf-0030086099,Out of School Community Education Project,The school provides educational and developmental activities for primary school age children.  The project will provide resources to run an out of school hours community education project.,2005-12-14,4995.0,360G-blf,The Big Lottery Fund,0.0314403814686
360G-blf-0031017100,Edenbrooke Primary School - School- based Counselling,Not Available,2014-12-04,9420.0,360G-blf,The Big Lottery Fund,0.0314093671065
360G-blf-0030001605,Bouncing to Success,The Appleton school will establish an after school trampoline club.,2007-05-30,5496.0,360G-blf,The Big Lottery Fund,0.0314089470822
360G-blf-0030074229,Royston Sports Legacy Project,The school will use the grant to setup a breakfast club and after school sports club for all pupils at the school.,2012-11-01,9540.0,360G-blf,The Big Lottery Fund,0.0314049229903
360G-blf-0030010820,Selby Abbey Primary School Community Open House,"Selby Abbey CE Primary School would use an award to develop a community room within the school, this would be used to accommodate the various after school clubs, and local community groups who's activities take place at the school. They will purchase computer equipment for use by these groups, and toys for the crèche.",2007-05-29,10000.0,360G-blf,The Big Lottery Fund,0.0314026810126
360G-blf-0030024999,Staging System,The school will use the grant to purchase a portable staging system for the new school hall which will be used by the local community.,2005-09-21,4782.0,360G-blf,The Big Lottery Fund,0.0313951594635
360G-blf-0030041937,Extended School Programme for disaffected pupils,"A project by this school in Kenilworth, Warwickshire to purchase exercise equipment so the group can run an out of school club for pupils and local community members.",2006-10-10,10000.0,360G-blf,The Big Lottery Fund,0.031393046838
360G-blf-0031014133,Queen Anne High School - School Sport,Not Available,2014-09-18,524.0,360G-blf,The Big Lottery Fund,0.0313783415948
360G-blf-0030130232,Rockingham Primary School - upgrade of two hard surfaces,This project will upgrade two playgrounds by providing a better surface with markings for games and fixture for sports at the Corby school.  The project will provide facilities that can be used in wet weather as well as facilities to develop sports and movement skills for pupils at the school.  The project will benefit 219 pupils at Rockingham Primary School and 100 pupils from schools in the Corby School Sports Co-ordinator programme.,2004-09-06,49270.0,360G-blf,The Big Lottery Fund,0.0313782760842
360G-blf-0030007884,Extended after-school activities,This school will run after-school clubs for children who have autism.,2006-12-21,6000.0,360G-blf,The Big Lottery Fund,0.031369118984
360G-blf-0030017599,Gaelscoil Ghleann Darach Extended Schools Programme,The Irish medium school is using the grant to run an extended schools programme to improve the language schools of its pupils.,2009-09-10,10000.0,360G-blf,The Big Lottery Fund,0.0313567895688
360G-blf-0030058675,Newton School Community Woodland Project,"Newton Primary School will create a pond, a woodland walk and circular assembly area on school grounds for pupils and families of the school. This will provide an educational wildlife area, and provide access to a currently unsafe outdoor area of the school. The wider community will help with its creation.",2011-03-04,9895.0,360G-blf,The Big Lottery Fund,0.0313366228261
360G-blf-0030006588,Introduction to Trampolining,Trinity RC School will use an award to fund equipment and coaching to run a programme of trampolining clubs for young people. The clubs will take place at lunch time for children of Trinity School and after school for advanced pupils and cluster schools. The project will bring together children from different primary schools and access trampolining for free with opportunity to taking the sport further.,2007-02-16,10000.0,360G-blf,The Big Lottery Fund,0.0313330186906
360G-blf-0030073412,Ormiston Primary School-From Shoot to Plate,The school will introduce healthy eating initiatives for both nursery and school pupils by creating gardens areas within the school grounds. The grant will also be used to purchasing outdoor play equipment.,2013-04-10,9680.0,360G-blf,The Big Lottery Fund,0.031322537765
360G-blf-0030019655,Staindrop Outdoor Education Group,"This school will purchase equipment in order to establish an outdoor activity group outside of school hours. The group will initially be made available to pupils of the school, and will be later be offered to other children and primary school age pupils.",2008-08-11,9589.0,360G-blf,The Big Lottery Fund,0.0313161884894
360G-blf-0030051757,The After School Fun Club's,"This is a project by a school in Bradford, West Yorkshire. The group will use funding to deliver four after school clubs per week for pupils aged 5-11 years. This will enable the school to provide various after school clubs throughout the school year, including drama, dance, music production and multi sports.",2011-06-16,6626.0,360G-blf,The Big Lottery Fund,0.0313059593721
360G-blf-0030122819,Ballinderry Primary School,This project will develop a polymeric MUGA (35m x 40.3m) complete with fencing and floodlighting at Ballinderry PS.  The school is situated in the village of Lower Ballinderry which is near Lough Neagh.  The facility will increase pupil's PE time from one to two hours per week and widen the range of sports activities currently available.  The primary beneficiaries of the project will be the 175 pupils at the school along with pupils from four other local primary schools and an estimated 150 community users.,2005-02-17,189480.0,360G-blf,The Big Lottery Fund,0.0312980067561
360G-blf-0030061536,Gosforth School Minibus,"The group will use the funding to purchase a minibus for use by the school, extended schools cluster and community groups. This will enable children in the area to attend various activities.",2011-04-01,10000.0,360G-blf,The Big Lottery Fund,0.0312843219092
360G-CFTyneWearNland-160035,Towards For six week programme of work with Whitburn Primary School in South Tyneside and St Charles School in Newcastle (£400 per school),Towards For six week programme of work with Whitburn Primary School in South Tyneside and St Charles School in Newcastle (£400 per school),2015-04-07T00:00:00+00:00,800.0,GB-COH-02273708,Community Foundation serving Tyne & Wear and Northumberland,0.0312759422004
360G-blf-0030059654,Howard Out of School Club,This is a project by a primary school in Croydon. The school will use funding to establish a breakfast and after school club and school holiday scheme for pupils and local young people. This will encourage the young people to develop healthy lifestyles through participating in physical activities and healthy eating sessions.,2011-05-05,9950.0,360G-blf,The Big Lottery Fund,0.0312635558408
360G-blf-0030114954,There is no project name available for this record,This school will run an after school horse riding club in conjunction with Craigengilan Stables.,2013-03-20,2000.0,360G-blf,The Big Lottery Fund,0.0312607687576
360G-blf-0030111287,There is no project name available for this record,The school will develop a programme of after-school physical activity sessions to engage children from a group of local cluster schools in a sports based competition.,2012-11-28,1718.0,360G-blf,The Big Lottery Fund,0.0312578504753
360G-blf-0030082683,John O'Gaunt School - Full Size Synthetic Turf Pitch,"This project will see the a  floodlit synthetic turf pitch built at the school. The aim of the project is to improve and increase access to sports for the school, its partner school and the local community, targeting those who are not currently participating in physical activity.  The main sports to take place will be football, rugby training, hockey and athletics.  It will benefit 600 pupils from the school, 300 pupils from partner schools and it will have 4000 wider community visits.",2004-07-26,415949.0,360G-blf,The Big Lottery Fund,0.0312537414132
360G-blf-0030006261,Elm Wood School out of hours project,A project by this primary school in Lambeth to run an after school drumming club and Capoeira ( Brazilian martial art practiced by African slaves in Brazil).,2007-01-09,4992.0,360G-blf,The Big Lottery Fund,0.0312394940359
360G-blf-0030120172,There is no project name available for this record, The school will use the grant to deliver a number of after-school sports clubs and will run a series of activities with other primary schools in the local area. The grant will pay for transport costs and coaching costs for after school clubs.,2011-10-27,1240.0,360G-blf,The Big Lottery Fund,0.0312291748051
360G-blf-0030003441,Health and Skills Project,"A project by this primary school to run a series of lunchtime and after-school physical activity workshops to develop attention, balance and co-ordination skills. This will culminate in a challenge day where pupils from other local schools will be invited to compete against pupils from this primary school in Kitts Green, Birmingham.",2008-03-17,4494.0,360G-blf,The Big Lottery Fund,0.0312020591516
360G-blf-0030066275,Dame Catherine's School House Renovation,"This is a project by a school in South Derbyshire. The school will use the funding to install school fencing, buy kitchenware and install anti-slip flooring. This will enable the school to provide cookery based activities and provide the community with a new meeting space as their are limited venues within the local area.",2013-08-01,8320.0,360G-blf,The Big Lottery Fund,0.031199850745
360G-blf-0030050397,Robin Hood's fun project to enhance outdoor community interaction,"This is a project by a primary school in Mansfield, Nottinghamshire. The school will use the funding to develop the playground for use before and after school and lunchtimes for pupils and community groups.",2011-12-15,9910.0,360G-blf,The Big Lottery Fund,0.0311673798562
