Identifier,Title,Description,Award Date,Amount Awarded,Funding Org:Identifier,Funding Org:Name,DocumentWeight
360G-blf-0030139989,Training for long term unemployed,"This project will provide training and support to long term unemployed and isolated people with the aims of reducing isolation, increasing skills and confidence and enabling beneficiaries to access volunteering, training or paid employment opportunities. The project will also provide pre-vocational and IT training courses and community workshops in a variety of subjects to engage people who may otherwise not take part in training.",2006-01-31,98430.0,360G-blf,The Big Lottery Fund,0.0270998471648
360G-RobertsonTrust-0060X00000U1k1YQAR,The Offshore Training Courses,The Offshore Training Courses,2018-03-09T00:00:00+00:00,2500.0,GB-SC-SC002970,The Robertson Trust,0.0270761520717
360G-dulverton-006D000000MJrNC,Training Courses,Training Courses,2008-05-08T00:00:00+00:00,25000.0,GB-COH-07991677,The Dulverton Trust,0.0270761520717
360G-dulverton-006D000000MJrF5,Towards probationary crew training courses,Towards probationary crew training courses,2006-02-02T00:00:00+00:00,40000.0,GB-COH-07991677,The Dulverton Trust,0.0270761520717
360G-blf-0030093253,Setting up a Community Training Centre,"This project in Barking and Dagenham will set up a new training centre. It will provide support and training in areas such as IT and English, and local organisations will be able to use it for their own training purposes.",2010-06-24,9880.0,360G-blf,The Big Lottery Fund,0.0270738333119
360G-blf-0030024282,Night Training Facility,"A project by this North Kesteven group to install floodlights at their training grounds to enable night training to take place. The increased training sessions will enable the group to increase their number of teams. The grant will include funding for floodlights and associated equipment, specialist labour, JCB and driver hire.",2008-06-17,3232.0,360G-blf,The Big Lottery Fund,0.0270713551239
360G-blf-0030133363,Bridge 4 Life,"This is a new application to create a modular training programme based at the organisation's Bridge Community Venue, targeting socially excluded local people. The project would provide training and mentoring sessions covering a range of topics such as budgeting, ICT and communication skills with the aim of improving the life skills and confidence of those attending. This would in turn, increase the training, employment and volunteering opportunities available to the users.",2006-06-12,50000.0,360G-blf,The Big Lottery Fund,0.0270640601273
360G-blf-0030097531,Air Training Corps - Ongoing training for D of E & B.T.E.C.,"This community group based in Grantham, Lincolnshire, will use an award to purchase equipment for use in training air cadets. This will enable the group to set up a website and intranet system that will allow the storage and maintenance of computerised cadets' records and will also help to facilitate their training including first aid, orienteering and navigation. The project will also provide study aids for participants who are training towards their Duke of Edinburgh Award and BTEC qualifications.",2009-12-04,3303.0,360G-blf,The Big Lottery Fund,0.0270509661991
360G-blf-0030073641,Havering Citizens Advice Bureau Training Unit Development,This is a project by a charity in Havering.The group will use the funding to purchase computer equipment and furniture for a new training room.This will equip the organisation to be able to offer a range of affordable training to volunteers and the community.,2012-09-20,9985.0,360G-blf,The Big Lottery Fund,0.0270377868465
360G-blf-0031040078,Lowland Rescue Advanced Medic Project,This project will use the funding to purchase additional Advanced Medic Kits and associated training equipment for volunteers. It will improve volunteer responders lifesaving skills and increase the survival rate of casualties.  ,2016-09-28T00:00:00+00:00,9316.0,360G-blf,The Big Lottery Fund,0.0270000936708
360G-blf-0030005549,Information and Training Resources,This charitable organisation will run training sessions for community group managers and for people interested in doing voluntary work.,2007-08-22,2190.0,360G-blf,The Big Lottery Fund,0.0269872081765
360G-blf-0030040496,Training courses for current practitioners,"The group provides counselling, mediation and personal development training for the general public. The award will fund equipment that would enable   training courses to be held at the group's premises rather than at the Relate institute in Doncaster.  The training room will also be available to  other local community groups.",2006-05-17,4907.0,360G-blf,The Big Lottery Fund,0.0269859251809
360G-blf-0030028953,Expedition training,"1st Cholsey Scout Group will be able to carry out a range of expedition training activities with help from a Lottery award.  Scouts will take part in first aid, health and safety and team building courses to help prepare them for an expedition to Uganda.  An award will pay for training camps, volunteer expenses, tools and training materials.",2005-12-16,4181.0,360G-blf,The Big Lottery Fund,0.0269847132916
360G-blf-0030021454,The Moor Trees Volunteer Officer Programme,"This Awards for All grant will enable the Moor Trees community group to train new volunteers to help deliver the groups services. The grant will pay for programme development, policy, volunteer officer contracts, staff training, first aid training, risk assessment training, health and safety training, travel and brochure.",2008-05-19,4798.0,360G-blf,The Big Lottery Fund,0.0269789220416
360G-blf-0031039938,Development Project: Re-use and Training Centre for Barrow & District,The organisation will use the funding to deliver training sessions to unemployed people. This will provide work based skills and improve participants' opportunities for employment.,2016-09-21T00:00:00+00:00,5290.0,360G-blf,The Big Lottery Fund,0.0269784440448
360G-blf-0030047655,training,The organisation is acting as lead partner to provide cluster training in the area. The award will fund peripatetic guidance tutoring and individual training for partnership members.,2006-05-24,5000.0,360G-blf,The Big Lottery Fund,0.0269723666351
360G-blf-0030087696,REstore Rochdale,"This group will use funding to set up training workshops in sewing, crafts and retail training. This will lead to employment opportunities and life skills for the disadvantaged women referred to the group.",2010-05-06,9975.0,360G-blf,The Big Lottery Fund,0.0269625035557
360G-blf-0030114737,There is no project name available for this record,"The school's project will focus on shinty. The grant will fund equipment, training for two volunteers, team bibs, a training parachute and transport to competitions.",2013-03-04,1130.0,360G-blf,The Big Lottery Fund,0.0269030058879
360G-blf-0030140643,Training & Information Service,This new project will enable the organisation to provide a training and information service for people with dyslexia across NI.,2006-01-23,119778.0,360G-blf,The Big Lottery Fund,0.0268893380284
360G-blf-0030109872,Community Empowerment Matters (CEM),"The grant will be used to deliver a wide range of support, training and networking events, including basic skills and computer training, community development training, community health training and to set up a community-networking forum to build relationships across the area",2009-04-03,626108.0,360G-blf,The Big Lottery Fund,0.0268870347732
360G-blf-0030060605,21@Maundy,"This is a project in Hyndburn, Lancashire to purchase IT equipment in order to expand its current services.  This will enable the organisation to provide life skills training such as basic literacy and financial awareness.The award includes funding for IT hardware and software, volunteer training, publicity, and project training materials",2011-06-02,9190.0,360G-blf,The Big Lottery Fund,0.0268828725256
360G-blf-0030047822,Extending and Developing Training Activities,The group will extend the cadets training programme so that they can cater for more cadets and expand the range of activities undertaken. Increased transportation capacity - facilitating training and improve presentations with appropriate equipment enhancing training as well as the standard of providing information for the wider public in the process of attracting more cadets and thereafter developing their skills.,2006-03-30,4754.0,360G-blf,The Big Lottery Fund,0.0268777570283
360G-blf-0030099536,Training for the changing environment of familes and disability,"This Islington charity will provide training for parents of disabled children on systems and information so they can support other families with disabled children across England. Volunteers will receive further training to build on their knowledge and experience, including negotiation skills, training the trainer, facilitation and managing meeting skills.",2009-07-30,9975.0,360G-blf,The Big Lottery Fund,0.0268575261696
360G-blf-0031052274,Inspiring Work,The group will use the funding to develop their service for marginalised women by providing additional support and training. This will enable women to identify their skills and gain access to further training or qualifications to improve their employment opportunities.,2017-08-16,9950.0,360G-blf,The Big Lottery Fund,0.0268527630149
360G-blf-0031002393,Work-Wise,"This community organisation in Taunton will use the funding to purchase laptops and safety locking devices to help people not in education, employment or training to search for job vacancies and training opportunities.",2014-01-06,1980.0,360G-blf,The Big Lottery Fund,0.0268454107102
360G-blf-0030061428,Work Preparation Programme,"This not-for-profit company in Hull will use funding to run non-accredited job skills workshops for adults who are not in education, employment or training. This will enable participants to develop the skills and confidence to progress to further training or into employment.",2011-04-07,9600.0,360G-blf,The Big Lottery Fund,0.026844322327
360G-blf-0031003214,Improved Volunteer Skills Delivery and Sustainable Business Activities,"This is a project by a community organisation in Falmouth, Cornwall. The group will use the funding to purchase radio equipment and provide training for new and existing volunteers. The training will help beneficiaries gain the skills and experience to improve their chances of accessing employment, educational or internship opportunities.",2014-01-23,10000.0,360G-blf,The Big Lottery Fund,0.0268334753355
360G-blf-0030046198,Hypoxic Training,The group will run specific training sessions for obese and overweight people.,2006-03-15,5000.0,360G-blf,The Big Lottery Fund,0.0268275678596
360G-blf-0030135863,4 E's Project,"The development grant will be used to develop the 4 E's project which, if successful at stage two, would provide training and skills development training to local people in Strabane.",2007-12-13,21164.0,360G-blf,The Big Lottery Fund,0.0268264784404
360G-blf-0030024480,Management & Volunteers Capacity Building Training Programme,This project will provide training for members and volunteers to enable them to gain skills in running a community group. The project will also encourage more people to volunteer to provide an advice and support service to the Bengali community in the area.,2008-12-09,9500.0,360G-blf,The Big Lottery Fund,0.0268252718676
360G-blf-0030069696,Training Development 2012,"The organisation, which delivers suicide prevention training across Northern Ireland, will use the grant to improve training resources.",2012-09-06,8513.5,360G-blf,The Big Lottery Fund,0.026807149859
360G-blf-0030090117,IT Training Programme,"This charity will use an award to run an IT training programme for adult members of the local community, including older people, single parents and the unemployed. The project will develop participants' ICT skills and provide a pathway to further training and employment opportunities.",2010-03-04,8535.0,360G-blf,The Big Lottery Fund,0.0267544631535
360G-LloydsRegisterFdn-G0041,Training for volunteer crew members,"Training in sea survival skills at the RNLI College, Poole, for volunteer lifeboat crews around the British Isles",2011-02-01T00:00:00+00:00,916510.0,GB-CHC-1145988,Lloyd's Register Foundation,0.026754243446
360G-blf-0030038850,Moving on Together,"This group provides support, advice, training, and organises social activities for local residents.  This project is to provide training and work placements for fifty candidates. This will help them gain nationally recognised qualifications so that they can move into paid employment.",2006-08-17,10000.0,360G-blf,The Big Lottery Fund,0.0267533343714
360G-blf-0030088451,Imtermediate Sail Training Equipment,"A project by this group based in Teignbridge, Devon to purchase new dinghies for use in training local children who may not otherwise have access to water based activities. The project will allow the group to offer new training activities to larger groups of young people as the current dinghies are not equipped to the required standard for intermediate training courses.",2010-04-08,10000.0,360G-blf,The Big Lottery Fund,0.0267039706623
360G-blf-0030078428,There is no project name available for this record,"This group provide support, advice and organise activities to improve environmental and social conditions within the community. The grant will be used to pay for first aid training, child protection training, committee training, children and youth training, programming training, a laptop, a printer and games day parachutes.",2008-10-23,3800.0,360G-blf,The Big Lottery Fund,0.0267037967712
360G-blf-0030001007,C & R Training Suite,This Leicestershire community group will create a training suite for staff and volunteers who work with elderly people in the community. Training would specifically target IT skills so that staff can improve their communication and services.,2007-11-19,5000.0,360G-blf,The Big Lottery Fund,0.026701722491
360G-blf-0031026762,"WRASAC Training, staff / volunteer development and support resources p",This group will use the funding to train and upskill staff. They will also purchase training equipment of a higher standard.,2015-09-08T00:00:00+00:00,9959.0,360G-blf,The Big Lottery Fund,0.0266755690128
360G-blf-0030034618,Unspecified,The project is to provide training facilities for a group of Sea Cadets. The money is for a portable classroom.,2005-08-23,5000.0,360G-blf,The Big Lottery Fund,0.0266578914292
360G-woodward:WCT1211,Towards the costs of training volunteers ,Towards the costs of training volunteers for the Young Witness Service in Surrey.,2011-01-28,1500.0,GB-CHC-299963,Woodward Charitable Trust,0.0266577478902
360G-blf-0031025335,SELF Awareness in the community,The organisation will use the funding to build capacity by training staff to deliver applied suicide intervention skills training to people within the local community. This will support those who are at risk of suicide and provide educational awareness training and reduce the stigma linked to suicide.  ,2015-08-05T00:00:00+00:00,109.0,360G-blf,The Big Lottery Fund,0.0266572845606
360G-blf-A4E_3_010128320,Training of staff/volunteers,"This group currently provide help, information, support and advice on health, education and employment for young black girls  in the London Borough of Barking and Dagenham, Havering.  The group would like to send their management and volunteers on training to develop and implement their policy and procedures.Training management committee (#750)a, training staff and volunteers (#1500), travel and childcare (#2200), computer printer (#450)",2004-09-21,4899.0,360G-blf,The Big Lottery Fund,0.0266358185057
360G-blf-0030014565,Broxtowe Volunteers Training Programme,"A project by this company based in Beeston, Broxtowe, to plan, advertise and run 18 training sessions for voluntary sector groups and individual volunteers who require more training.",2009-03-31,7418.0,360G-blf,The Big Lottery Fund,0.0266351350657
360G-blf-0031026749,Think Thrive! Acceptance and Commitment Training Programme,This group will use the funding for a pilot project in Acceptance and Commitment Training which will involve training their trainers in ACT and then the trainers will train people in the community.,2015-09-08T00:00:00+00:00,7160.0,360G-blf,The Big Lottery Fund,0.0266185125851
360G-blf-0030040330,Training,"This group promotes voluntary work and advances the education of volunteers by providing advice, information and assistance in the Stevenage area. This project will enable the group to deliver a training programme to volunteer involving organisations to increase their skills in the recruitment, retention and management of volunteers.",2006-04-28,5000.0,360G-blf,The Big Lottery Fund,0.0266120224993
360G-blf-0030061448,Community Cohesion Programme,"This charity based in Scunthorpe will use funding to provide training for management committee members, volunteers and beneficiaries. This will help the group provide more services for the community and provide skills training for beneficiaries.",2011-04-07,9340.0,360G-blf,The Big Lottery Fund,0.0266115496184
360G-blf-0031033139,"Employability & Life Skills Training for the Homeless in Taunton,Somer","The group will use the funding to provide employment and life skills training for people whom are experiencing the effects of homelessness. This will increase skills, confidence and future prospects.  ",2016-03-23T00:00:00+00:00,7320.0,360G-blf,The Big Lottery Fund,0.0266031262753
360G-blf-0030012071,Volunteer Training Programme,"The award is for a project by a group in St Pauls, Bristol to hold training sessions for volunteers within the organisation covering drug awareness, issues relating to female sex-workers and improving people skills. The grant will contribute towards training days, a drug awareness training kit and the National Conference.",2007-03-28,5360.0,360G-blf,The Big Lottery Fund,0.0265991308789
360G-blf-0030058677,Training Basic Skills course for disadvantaged refugee French-Speaking,"This is a project by a community group in Wandsworth. They will use funding to provide refugees, whose main language is French, with skills to improve their employment opportunities and training and support to help them find work.",2010-10-14,9660.0,360G-blf,The Big Lottery Fund,0.0265849138279
360G-blf-0030003416,The Ambassador Training Programme,This junior school would use a grant to provide parents with the necessary skills and confidence to go on and receive further training or apply for work. The Ambassador training programme includes 'Getting Ready for Work' and 'Basic Food Hygiene' courses.,2008-02-27,9806.0,360G-blf,The Big Lottery Fund,0.0265749077409
360G-blf-0030028181,Flight simulation,"A flight simulation training package will be bought with the award money, to provide a more sophisticated level of training in aviation, including communication, navigation and control skills.",2005-08-24,5000.0,360G-blf,The Big Lottery Fund,0.0265664359435
360G-blf-0030020703,Training,This childbirth trust provides support and information to ante and post natal parents. The project is to provide training for new volunteers at the organisation and provide specialist training for three trainees in the form of antenatal teaching and a breastfeeding counsellor.,2008-04-18,5640.0,360G-blf,The Big Lottery Fund,0.0265659270985
360G-blf-0030003523,Sources Care Cultural Awareness Training for Health,"This community group would use an award to develop a range of training materials to deliver cultural awareness training to the wider community. Group members would receive training and would then deliver training sessions to local organisations, relaying what they have learnt. The group would also hold three promotional events to raise awareness of their work.",2007-11-27,9700.0,360G-blf,The Big Lottery Fund,0.0265637937401
360G-blf-0030037998,There is no project name available for this record,"This group is a voluntary run organisation committed to providing quality coaching and training facilities for the martial art of Jiu Jitsu.  The grant will be used to expand the matted training space, provide new martial arts pads, gloves and safety training weapons, Jiu Jitsu starter courses, coaching and training courses.  This will enable existing and new participants to develop their skills and create healthier lifestyles.",2006-06-22,4841.0,360G-blf,The Big Lottery Fund,0.0265562920654
360G-blf-0030037334,Presentation equipment,"Presentation equipment will enable this Air Training Corps to provide professional training, increasing computer skills and providing access to the internet. Cadets will have new learning opportunities as the group will run more courses.",2005-04-21,3570.0,360G-blf,The Big Lottery Fund,0.026516555846
360G-blf-0030066330,All Sewn Up Training Project,This is a project by a charity in Lambeth. The group will use the funding to purchase new equipment to deliver textile workshops for local people. This will enable beneficiaries to gain employability skills for those living in disadvantaged areas to increase the chances of finding further training and employment opportunities.,2013-08-01,8997.0,360G-blf,The Big Lottery Fund,0.0265015173412
360G-blf-0030097439,ISC - Gymnastics and Coaches Training Development Project 2010,"This group will purchase a range of equipment for use in gymnastics and cheerleading activities. This will improve the training and competitive performances of the young girls who attend the group. The award will also fund coaching of volunteers and skills training for performers. This grant will pay for tumble run, incline mats, 2 crash mats, team kit, private skill clinics, and coach training.",2009-11-17,9911.0,360G-blf,The Big Lottery Fund,0.0264981703457
360G-blf-0030023966,Rea Learning and work advice,"This group would use funding to provide work experience, training and support for the unemployed through a 12 week volunteer training programme. The grant will pay for publicity, stationery, volunteer expenses, training materials and supervision.",2008-06-17,4874.0,360G-blf,The Big Lottery Fund,0.0264831441526
360G-blf-0030052033,Training for Everyone,This is a project by a voluntary and community organisation in Reading. The group will use the funding to refurbish office space to develop a training arm of the organisation. This will enable the group to develop a training suite in order to produce training programmes focusing on IT and Media.,2011-05-26,9600.0,360G-blf,The Big Lottery Fund,0.0264712095029
360G-blf-0031048920,ICT TRAINING AND EMPOWERMENT CLASS,"This project will run basic IT training classes for young people have newly arrived in the UK and who are not in education, employment or training. This will develop life skills which will build self-confidence and remove barriers to employment.",2017-05-03,9828.0,360G-blf,The Big Lottery Fund,0.0264709240809
360G-blf-0030140778,IT and Basic Skills Training,"This organisation provide IT and basic skills training to people with profound disabilities so as to gain confidence and practical skills to secure employment and the project will also enable them to take part in the opportunities offered through Lifelong Learning and through a Direct Payments Scheme run by Social Services in Torbay and Devon.This three year grant will pay for the salary of a worker as well as meet the fees of freelance workers, the purchase of office equipment and travel, training and othe",2005-04-26,32085.0,360G-blf,The Big Lottery Fund,0.0264577894013
360G-COOPGROUP-7305,Grant to B.L.E.S. Training,We would like to convert an existing training workshop into a plumbing training area to up-skill young people in West Lothian.,2017-11-29,1403.87,GB-COH-IP00525R,Co-operative Group,0.0264466107844
360G-blf-0030096758,There is no project name available for this record,"This group will purchase and install IT equipment and develop a training programme within the volunteers and staff teams. The training programme will be adapted to different styles and stages of learning enabling the organisation to provide a more efficient service to clients. The grant will fund IT equipment, installation costs and IT training.",2009-03-11,5500.0,360G-blf,The Big Lottery Fund,0.0264413914937
360G-blf-A4E_3_010136980,"Equipment, seminars and training","The award will allow this karate group to purchase much needed equipment and training materials that will allow them to expand their activities and offer more opportunities for karate in their area. karate equipment, printers, seminars, competitions, medals and training videos.",2004-11-05,4112.0,360G-blf,The Big Lottery Fund,0.0264210914736
360G-blf-0030109526,BCT Community Action,"This project, targeting the Beechwood and Ballantyne estates in Merseyside, will offer training and support to individuals stated as suffering multiple deprivations. Ten skills courses will be delivered, aimed at enhancing skills such as numeracy, literacy and team working. Volunteering and placement opportunities will also be available and encouraged, including volunteer learning guides within the training centre itself to act as peer mentors for those beginning the training.",2009-11-11,350668.0,360G-blf,The Big Lottery Fund,0.0264157082678
360G-blf-0031005326,Training Aids for Cadet Development,"Welshpool A.T.C. Squadron in Powys will use the grant to purchase additional training equipment for their cadet squadron. This project meets the Awards for All aim of increase skill and creativity. This grant for £4,999 will fund the purchase of additional radio, sports, computer, printer, waterproof OS maps, first aid training equipment, high visability vests, and fitness and agility training equipment.",2014-03-04,4999.83,360G-blf,The Big Lottery Fund,0.0264016947458
