Identifier,Title,Description,Award Date,Amount Awarded,Funding Org:Identifier,Funding Org:Name,DocumentWeight
360G-blf-0030128772,Immanuel & St Andrew C of E Primary School - Floodlit Multi Use Games Area,"The new floodlit multi-use games area at the Immanuel & St. Andrew CofE Primary School will enhance the quality of PE and sport for 300 pupils from the school, as well as over 300 from six other primary schools with whom they have close links. The project will play a large part in the continued success of the Immanuel Youth Club, which is based at the school, and will create opportunities for wider community use of the school site. Activities will include basketball, 5-a-side football, tennis and cricket.",2004-04-19,73440.0,360G-blf,The Big Lottery Fund,0.0303939320387
360G-blf-0030056574,To Improve the Outside Environment for all Pupils in School,"This primary school based in Doncaster will use funding to create an outdoor adventure playground at the school, part of which will be designed by pupils.",2011-03-03,9764.0,360G-blf,The Big Lottery Fund,0.0303763391262
360G-blf-0030022330,Griffin Sports Development,This primary school will use an award to provide a variety of after school sports activities for children. The school have identified new activities such as fencing and judo that are not taught at the school. All activities will be free to ensure they are accessible to all children at the school.,2008-12-18,9030.0,360G-blf,The Big Lottery Fund,0.0303640457936
360G-blf-0030012814,Cross Community Primary School Twinning,The school will use the grant to run a twinning project involving pupils from two schools based in high interface areas of Belfast.,2010-01-14,1025.0,360G-blf,The Big Lottery Fund,0.0303628131694
360G-blf-0031001719,School house garden,"This is a project by a school in Southville, Bristol. The group will use the funding to clear and create a garden area which will include chickens and bees, on the school grounds. This will provide the school with a green space which they can use for nature based activities, as the school does not have access to this type of area locally.",2013-12-05,9052.0,360G-blf,The Big Lottery Fund,0.0303577730992
360G-blf-0030129078,Singleton CofE Voluntary Aided Primary School Multi Use Games Area,"Funding will be used to create a new multi-use games area at the school. The project  aims to have a significant impact on the quality of PE provision for the school pupils.  Activities planned include after school clubs, before school clubs, a summer school, athletics, tennis, kwik cricket, PE, netball, hockey and basketball. Users will consist of 100 children from the school plus 50 people from the wider community.",2004-04-19,75954.0,360G-blf,The Big Lottery Fund,0.0303480937774
360G-blf-0030019945,Out of school performing arts club,The project is to establish before school clubs for primary school children. The money is for staff costs and equipment.,2008-06-16,3950.0,360G-blf,The Big Lottery Fund,0.0303413841386
360G-blf-0030012940,Our Inspiring Environment,This school will use an award to create an improved environment in the school grounds. They will install a trim trail and other play equipment that will encourage the development of the children's physical and mental skills. The facilities will be used by the school and also out of school hours by after school clubs.,2009-08-13,9462.0,360G-blf,The Big Lottery Fund,0.0303381075552
360G-blf-0030043075,After school bike skills club,This primary school will provide an after-school bike skills club run by instructors from the local bike club in 16 primary schools in Penwith.,2006-08-21,8660.0,360G-blf,The Big Lottery Fund,0.0303372343368
360G-blf-0030093595,Let's Get Out,"This is a project by a school in Great Witley, Worcester. The school will use the funding to provide forest school activities for children.",2010-10-21,3503.0,360G-blf,The Big Lottery Fund,0.0303252562043
360G-blf-0030091781,Tower Hill Eco Hub,"This is a project by a primary school in Rushmoor, Hampshire. They will use funding to build a gazebo to be used as an outdoor classroom at the school and to make a garden area. This will create a new outdoor space and enable the school to provide new activities to pupils and the local community.",2010-07-22,9853.0,360G-blf,The Big Lottery Fund,0.0303181456567
360G-blf-0030092678,"Growing food, improving biodiversity and enhancing the visual environment",This is a project by a school in Enfield who will use the funding to construct an environmental area within the school ground. This will provide pupils of the school with access to an open space within an urban area that will allow for new activities and clubs to be run. The school will make the area available for use by local schools and community groups.,2010-08-19,1812.0,360G-blf,The Big Lottery Fund,0.0303038350377
360G-blf-0030002298,Ceramic and Mosaic Mural: Learning as a community,This school will use an award to run workshops in their school and three other primary schools to design and produce a mosaic. The workshops will be run after school and during holidays and will help to develop pupils skills and creativity.  The completed mosaic will be hung on the outer wall of Misbourne School for the whole community to enjoy.,2007-04-17,10000.0,360G-blf,The Big Lottery Fund,0.030297406563
360G-blf-0030024007,Out of School Hours Multi Sports Clubs,This school will use funding to provide a variety of after-school multi-sports clubs. The school will purchase new sports equipment and professional coaches will run the sessions. This will benefit pupils at the school and in particular those who face barriers to participating in coaching out side of school due to financial restraints.,2008-10-20,8362.0,360G-blf,The Big Lottery Fund,0.0302856832361
360G-blf-0030048651,St Barnabas Trim Trail,"This primary school wishes to install a trim trail on the school site. It will be used for before and after school clubs, during lunch and play times and by a range of community groups who use the school site. The school does not currently have any playground equipment other than markings.",2006-04-28,4975.0,360G-blf,The Big Lottery Fund,0.0302829370854
360G-blf-0030018299,Enhancing St Canice Primary School Playground to develop Physical Activity,The school will use the grant to improve their playground so it can be used after school to improve pupils' health and fitness.,2009-11-05,10000.0,360G-blf,The Big Lottery Fund,0.0302730858217
360G-blf-0030022188,Before and After School Sporting Clubs,This school will provide sports coaches to allow school children to engage in team activities in a before and after school club.,2008-12-09,10000.0,360G-blf,The Big Lottery Fund,0.0302726436283
360G-blf-0031045156,Greenfield Activity Club,"The funding will be used by a primary school to run a series of after school physical activities for pupils. The project will encourage children to participate in healthy exercise out of school hours, with the aim of reducing childhood obesity at the school.",2017-02-01T00:00:00+00:00,9720.0,360G-blf,The Big Lottery Fund,0.0302714570688
360G-blf-0030093966,Earith School Agility Trail,"This primary school will use an award to provide an agility trail in the school grounds. The area will be used by the pupils at break times and by on site pre-school, after school and holiday clubs. Community groups will also have access to the facility at evenings and weekends. The project will provide a free, secure play facility for local children.",2009-05-22,9752.0,360G-blf,The Big Lottery Fund,0.0302683535352
360G-blf-0030048618,After school sports,This group raises funds for and organises activities at the Monks Abbey School. The project is to run after school sports clubs for children at the school. The award is for equipment and coaching fees.,2006-03-31,3500.0,360G-blf,The Big Lottery Fund,0.0302283553485
360G-blf-0030011640,Project Oarsome,A project to enable this school in Newcastle under Lyme to run extra curricular rowing sessions for pupils at this school and pupils at local primary schools.,2007-03-15,8950.0,360G-blf,The Big Lottery Fund,0.0302268748431
360G-blf-0030092067,R SPACE Recreational Safe Play and Creative Environment,The primary school in Merton will use the funding to install a range of sports games in the school playground for use of various school clubs and community groups out of school hours.,2010-07-08,10000.0,360G-blf,The Big Lottery Fund,0.0302267510802
360G-CFTyneWearNland-160593,Towards Support for six schools to take part in EES Year 2,Towards Support for six schools to take part in EES Year 2,2016-04-01T00:00:00+00:00,10000.0,GB-COH-02273708,Community Foundation serving Tyne & Wear and Northumberland,0.0302190822244
360G-Walcot-0068000000usNKNAA2,Year 6 School Journey to the Carisbrooke Hotel in Bournemouth,Year 6 School Journey to the Carisbrooke Hotel in Bournemouth,2015-02-05T00:00:00+00:00,1170.0,GB-CHC-312800,Walcot Foundation,0.0302190822244
360G-blf-0031002679,School Skiing for P6/7 Year Group,School Skiing for P6/7 Year Group,2014-01-14,2000.0,360G-blf,The Big Lottery Fund,0.0302190822244
360G-blf-0031002684,School Skiing for P5/6/7 Year Group,School Skiing for P5/6/7 Year Group,2014-01-14,1983.0,360G-blf,The Big Lottery Fund,0.0302190822244
360G-CFTyneWearNland-160592,Support for six schools to take part in EES Year 1,Support for six schools to take part in EES Year 1,2015-07-13T00:00:00+00:00,10000.0,GB-COH-02273708,Community Foundation serving Tyne & Wear and Northumberland,0.0302190822244
360G-blf-A4E_3_010172699,childrens' rememberance tide wreath,Children from schools and playgroups in the Calne area will make a Remembrance Tide poppy wreath.,2005-07-21,500.0,360G-blf,The Big Lottery Fund,0.0302072122502
360G-blf-0031011903,Supplementary School for children,Not Available,2014-07-23,8010.0,360G-blf,The Big Lottery Fund,0.0302072122502
360G-blf-0031003754,School Skiing for P1-7 Children,School Skiing for P1-7 Children,2014-01-31,1650.0,360G-blf,The Big Lottery Fund,0.0302072122502
360G-blf-0030047151,Reflections,"A project by this primary school in Fillongley, Warwickshire to provide an out of hours school club where children will work with local community artists and history group to create an art area within the school. This will celebrate the schools 10th Anniversary.",2006-03-31,5000.0,360G-blf,The Big Lottery Fund,0.0302040382942
360G-blf-0030003766,School in the Community,"This primary school would provide a series of out of school hours football, hockey, netball, basketball, gymnastic and rugby coaching training sessions to pupils and interested young people from the surrounding community. These sessions would take place after school, during school holidays and at weekends.",2008-02-27,9951.0,360G-blf,The Big Lottery Fund,0.0301810235024
360G-blf-0031004992,Riverside School Community Sport Improvement Project,The school will use the funding to purchase equipment and coaching for their after school clubs.,2014-02-26,2000.0,360G-blf,The Big Lottery Fund,0.0301584098549
360G-blf-0030036302,after school tag club,The club will run after school rugby sessions for children from 5 local primary schools.,2005-03-03,612.0,360G-blf,The Big Lottery Fund,0.0301311568575
360G-blf-0030069734,Lets Get Jiggy - Fitness for Fun,This is a project by a primary school in Tameside. The organisation will use funding to create a multi-activity area in the school grounds for pupils and their families. This will provide opportunities for outdoor play and out of school activities.,2012-08-02,10000.0,360G-blf,The Big Lottery Fund,0.0301247505848
360G-blf-0030089503,Getting the Community of The Bishop Harvey Goodwin School Active,This school will use an award to fund an adventure trail in the school grounds for school-based and community use. This will increase outdoor physical play in an area of socioeconomic deprivation and lacking in facilities.,2009-12-10,8258.0,360G-blf,The Big Lottery Fund,0.0301109047391
360G-blf-0030001920,Extended schools fundamentals for all,"This High School is to set up an after school club and offer activities such as martial arts, indoor athletics, and dance sessions.  The club will be based within the school and would be offered to primary and secondary school children.",2007-07-24,4575.0,360G-blf,The Big Lottery Fund,0.0301061723684
360G-blf-0030049383,There is no project name available for this record,The school will use an award to fund after school and school holiday multi-sports and games activities.,2006-03-30,5000.0,360G-blf,The Big Lottery Fund,0.0300954193456
360G-blf-0030039261,There is no project name available for this record,"This primary school would like to provide outdoor shelters in the school grounds for pupils, which would also be used by the community during school holidays. The project is part of the school's 'sun safety' policy and would enable children to have access to a shaded environment when taking part in outdoor physical activity.",2006-05-22,4790.0,360G-blf,The Big Lottery Fund,0.0300922245011
360G-blf-0030081542,There is no project name available for this record,"This group promote co-operation between pupils, parents and teachers at Annick Primary school and provide additional facilities and resources to support education within the school.This grant will fund stained glass wall plaque, school photographs, commemorative drinking mugs and 4 picnic benches.",2005-05-16,5000.0,360G-blf,The Big Lottery Fund,0.0300883978534
360G-blf-0030003376,St Patricks RC Comprehensive Primary Development Plan,"This school will offer coaching in sports such as hockey, netball, basketball, badminton and rock climbing to children from feeder primary schools in the area. The school will also hold sporting festivals and competitions for pupils of their school.",2008-02-20,10000.0,360G-blf,The Big Lottery Fund,0.0300859367005
360G-blf-0031004873,Castledawson Primary School - Health and Happiness in our Playtime,"The school will use the grant to run the Health and Happiness in Our Playtime project, which will improve the school playground to promote healthy activities.",2014-02-24,9417.0,360G-blf,The Big Lottery Fund,0.0300782389283
360G-blf-0030062426,Arunside School Portable Staging,"This group in West Sussex will use the funding to purchase a portable staging system for the school hall for use by the school and local community groups. This will enable the school and other groups to access a stage system for their events such as performances, presentations, quiz nights and karate.",2011-06-02,9050.0,360G-blf,The Big Lottery Fund,0.0300299981459
360G-blf-0030068785,Laptops For Extended Hours Provision,"This is a project by a school in Taunton, Somerset. The school will use the funding to purchase new computers to deliver extracurricular ICT sessions for the pupils of the school. This will improve the facilities of the school to enable beneficaries to extend their learning and development in IT skills. Funding is for IT equipment and installation.",2013-06-27,9984.0,360G-blf,The Big Lottery Fund,0.0300281992863
360G-blf-0030069493,Skipsea Primary School Outdoor Play Facilities,This is a project by a primary school in Skipsea. The organisation will use funding to purchase and install an outdoor canopy adjacent to the classrooms of the younger pupils for the benefit of children at the school and the wider community. This will enable them to play outside and allow after school activities to go ahead in all weathers.,2012-06-28,7140.0,360G-blf,The Big Lottery Fund,0.0300189887277
360G-blf-0030103311,There is no project name available for this record,The school will take its pupils to various inter-schools sports competitions throughout West Lothian. The school's Physical Education Department wants to encourage more of its pupils to participate in different sports. The grant will fund transport costs and school sport strips.,2010-11-19,890.0,360G-blf,The Big Lottery Fund,0.0299851967578
360G-blf-0030072997,Thornton Grammar School Health and Activity Project,"This is a project by a secondary school in Bradford. The organisation will use the funding to install two vandal proof concrete outdoor table tennis tables in the school grounds for use by pupils before school, during breaks and at lunch time as well as members of the local community during dual use sessions outside of normal school hours. This will encourage local children and adults to take part in healthy physical activity.",2013-01-24,3960.0,360G-blf,The Big Lottery Fund,0.0299814904432
360G-blf-0030029387,After school clubs,This special school will use the award to develop after-school provision. A range of after-school activities will be offered including some sessions with professionals from within the local community.,2006-01-13,4771.0,360G-blf,The Big Lottery Fund,0.0299726138643
360G-blf-0030129184,Cams Hill School - Dance Studio,"Hampshire LEA will provide a new Dance Studio at Cams Hill school, Fareham. The new facility will enable the school to delivery a wider curriculum and will increase opportunities available to it's pupils, partner schools and the wider community.",2004-09-06,180000.0,360G-blf,The Big Lottery Fund,0.0299546438264
360G-blf-0030022232,ASK - (After School Klub) - You Just have to Ask!,"A project by this Primary School in Spaxton to provide after school clubs in multi-sports, eco gardening and a Cyber Café, creating a hub for the community.",2009-01-19,5895.0,360G-blf,The Big Lottery Fund,0.0299484423517
360G-blf-0030129888,Yew Tree Primary School - Changing Facilities,"Sandwell Metropolitan Borough Council will build new wet and dry changing facilities at this primary school site.  The project will increase participation in activities such as swimming, football and netball. Currently there are limited opportunities available within the school's catchment area, resulting in the school-aged population only engaging in physical activity whilst at school.  The project will benefit 180 pupils, 200 pupils from other schools and 200 community users.",2004-04-19,299572.0,360G-blf,The Big Lottery Fund,0.0299391834735
360G-blf-0030064672,Friends of Towie School Skiing Development Programme,The school will use the grant to fund transport to and skiing instruction for their pupils in the Cairngorms .,2012-11-30,1966.0,360G-blf,The Big Lottery Fund,0.0299324803273
360G-blf-0030123058,"Ridgepark School, Lanark","This project will provide a multi-use games area with floodlighting and fencing at Ridgepark School in Lanark. This is a special needs school for pupils of secondary school age with emotional and behavioural difficulties. A total of 500 people will benefit, with 50 pupils from the school, 250 from other schools throughout the area and 200 users from the wider community. The facility will support a variety of physical activities including five-a-side football, tennis and basketball.",2004-05-26,155557.0,360G-blf,The Big Lottery Fund,0.0299251209371
360G-blf-0030004528,SASP at Critchill,"A project by this special school in Frome, Somerset, to run additional sports and play activities for pupils at this school and other special schools. The school will also resurface their playground and divide the area up into sections to cater for the different needs of the pupils.",2008-03-17,10000.0,360G-blf,The Big Lottery Fund,0.0299223572401
360G-blf-0030016886,New Hall Forest School,"This is a project by a school in Sutton Coldfield, Birmingham. The group will use the funding to set up a Forest School on the school grounds. This will enable the school to provide nature based activities to pupils and teach them about local wildlife and how they can take care of the environment.",2013-01-31,5620.0,360G-blf,The Big Lottery Fund,0.029922296066
360G-blf-0030070971,Getting Active Outdoors,"The is a project by a primary school in Cowes, Isle of Wight. The organisation will use the funding to take a piece of wasteland on the school site and turn it into a usable green learning zone for use by children at the school for active learning and after school activities.",2012-04-25,9950.0,360G-blf,The Big Lottery Fund,0.0299214841284
360G-blf-0030047733,Monkeynastix Programme,"The school provides education and development opportunities for primary school age children, in the Cregagh and surrounding area of Castlereagh.  The project will deliver an out of school monkeynastix programme for 4-7 year olds.",2006-05-10,5000.0,360G-blf,The Big Lottery Fund,0.0299056611351
360G-blf-0031005863,Newport Primary After School Activities,Newport Primary After School Activities,2014-02-21,2000.0,360G-blf,The Big Lottery Fund,0.0299047386254
360G-blf-0030061525,Manadon Minibeast Madness,This is a project by a school in Plymouth. The school will use the funding to create a wildlife area within the school grounds. This will enable them to enhance teaching and learning about wildlife throughout the school.,2011-03-04,4000.0,360G-blf,The Big Lottery Fund,0.0298937032601
360G-blf-0030097850,The Lakes Trim Trail,This secondary school will use an award to install a trim trail within an underused area of the school grounds. The project will create a new fitness facility at the school for the benefit of pupils and local community groups that use the school's facilities.,2010-01-21,8480.0,360G-blf,The Big Lottery Fund,0.0298736334596
360G-blf-0030097268,Buy a Bus for Birchen Coppice,"A project by this primary school based in Kidderminster, Worcestershire to purchase a new minibus to be used for educational trips and school visits. The minibus will be available for use by local schools, including a school for pupils with special educational needs.",2009-09-11,10000.0,360G-blf,The Big Lottery Fund,0.0298720786031
360G-blf-0031016554,Whole school inclusion to after school activities,Not Available,2014-11-26,10000.0,360G-blf,The Big Lottery Fund,0.0298649781543
360G-blf-0030112622,There is no project name available for this record,"The school, located in Dundee, will refurbish an old misused area of the school to provide a space for the development of new after school sports sessions.",2012-10-15,1995.0,360G-blf,The Big Lottery Fund,0.0298608329004
360G-blf-0030057704,The Wild Area Project,"This school in Tamworth, Staffordshire, will use funding to develop an area of unused land within the school and develop an outdoor learning facility which will be accessible for use by the whole school and the local community.",2011-02-24,9400.0,360G-blf,The Big Lottery Fund,0.0298601725032
360G-blf-0030136388,Colvend Primary School,The school will create an orchard on private land adjacent to the school grounds. The project will also provide bird and insect habitats as well as planting shrubs and wildflowers. The breathing place will be open to the whole community and the school plan to use it for curricular work once complete. The school will coordinate volunteers to create and maintain the breathing place.,2007-05-07,1900.0,360G-blf,The Big Lottery Fund,0.0298536740893
360G-blf-0030058364,Blooming Marvellous,This school in Settle will use funding to create an onsite allotment for the school's new gardening club. This will give pupils access to a new facility and a new after school provision.,2010-08-19,3514.0,360G-blf,The Big Lottery Fund,0.0298533543847
360G-blf-0030013029,It's theatre NOT soap darling,"This secondary school will use funding to work with eight secondary schools, two primary schools and one special needs school on an outside schools hours project. Short pieces of theatre will be created and performed over two days. The project will encourage schools to mix and encourage able bodied and disabled people to work together creatively.",2009-04-27,7751.0,360G-blf,The Big Lottery Fund,0.0298480305788
360G-blf-0030023646,Out of School Hours Activities,"This primary school will use funding to install play and sporting activities on their grounds. This will enable pupils, parents and the wider community to access the new facilities out of school hours. The school will develop community links through a children's centre on the school site to provide access for local groups to use the play resources.",2008-10-20,9297.0,360G-blf,The Big Lottery Fund,0.0298440697093
360G-blf-0030122303,Cwrt Sart Comprehensive School,"Neath Port Talbot CBC will build a new artificial turf pitch at Cwrt Sart Comprehensive School. The main aims of the scheme are to develop PE provision for all pupils including the development of dragon sport activities for primary pupils, to provide a safe and suitable surface for special needs pupils and to develop the school as a community resource to act as a centre for local community. The main beneficiaries will be the 1,070 pupils from Cwrt Sart School and neighbouring primary schools.",2004-05-11,128772.0,360G-blf,The Big Lottery Fund,0.0298399916939
360G-blf-0030129842,Brackenhale School - New trampoline hall and changing,"The project will provide a permanent trampolining facility (19m x 28m) at Brakenhale Secondary School in Bracknell.  It will raise the standard of physical education offered to school pupils and provide an activity suitable for wide ranges of age, fitness and ability.   The project will provide trampolining for 550 pupils at the school, 1668 pupils from other schools and 410 community users.",2004-12-13,290648.0,360G-blf,The Big Lottery Fund,0.0298398560872
360G-blf-0031023141,Make a meal of it.,This group will use the funding to run a school holiday activity club for school pupils.  ,2015-06-12T00:00:00+00:00,10000.0,360G-blf,The Big Lottery Fund,0.0298348810845
