Identifier,Title,Description,Award Date,Amount Awarded,Funding Org:Identifier,Funding Org:Name,DocumentWeight
360G-blf-0031004655,Volunteer Skills and Training,"This is a project by a charity based in Southwark, serving beneficiaries across London. This homeless charity will use the funding for the training of their volunteers in mental health awareness, safeguarding, listening skills and dealing with confrontation.",2014-02-20,9200.0,360G-blf,The Big Lottery Fund,0.0294058698696
360G-blf-A4E_3_010108180,There is no project name available for this record,Group to send volunteers on FA approved training courses in order that the young players have appropriately qualified training.,2004-04-22,3650.0,360G-blf,The Big Lottery Fund,0.0293579961554
360G-dulverton-006D000000MJrJl,Towards volunteer training and equipment,Towards volunteer training and equipment,2007-05-10T00:00:00+00:00,2500.0,GB-COH-07991677,The Dulverton Trust,0.0293562780642
360G-blf-0031046858,Customer Service Training Suite,The project will provide a customer service training suite where people can take part in training in essential front of house skills to improve their employability.,2017-03-08T00:00:00+00:00,6600.0,360G-blf,The Big Lottery Fund,0.0293382140252
360G-blf-0030044546,Newsletter and Volunteer Training,The group will purchase a computer and software to produce a community newsletter and provide training to increase the skills of current volunteers.,2006-02-22,4790.0,360G-blf,The Big Lottery Fund,0.0293271515371
360G-blagravetrust-00658000007A1UQ,Training on feedback for Portsmouth VCS,Improving feedback skills for Portsmouth VCS - Feedback Fund 2016,2016-08-09T00:00:00+00:00,3933.0,GB-CHC-1164021,The Blagrave Trust,0.0292817297788
360G-blf-0030089680,Workforce Development Training Programme,"A project by this charity in Haringey to improve the skills of volunteers and staff of local groups, to enable them to provide a better service to the community. The project will provide training workshops and an online manual.",2009-12-23,9980.0,360G-blf,The Big Lottery Fund,0.0292577848966
360G-EssexCF-A437060,Training equipment and venue hire for update training,To purchase a public access defibrillator and training equipment,2017-05-23T00:00:00+00:00,2000.0,GB-CHC-1052061,Essex Community Foundation,0.0292163111075
360G-blf-0031000406,Futureproof - Street Arts Academy (SAA) Youth Panel Training Programme,"This is a project by a charity in Greenwich. The group will use the funding to run a youth training programme that will teach life skills including leadership, management training and child protection. This will enable the participants to learn key life skills which will improve employment and furture training opportunities.",2013-10-24,10000.0,360G-blf,The Big Lottery Fund,0.0291845096342
360G-EssexCF-A427027,Development of a Training Suite and Financial Capability Training,Towards the development of a Training Suite and Financial Capability Training for volunteers at North East Suffolk Citizens Advice Bureau,2016-11-22T00:00:00+00:00,1395.0,GB-CHC-1052061,Essex Community Foundation,0.0291828476836
360G-dulverton-006D000000MJrHW,Towards equipmet and training costs,Towards equipmet and training costs,2006-10-24T00:00:00+00:00,1500.0,GB-COH-07991677,The Dulverton Trust,0.0291548618615
360G-dulverton-006D000000MJrDC,Towards project and training costs,Towards project and training costs,2005-10-26T00:00:00+00:00,2000.0,GB-COH-07991677,The Dulverton Trust,0.0291548618615
360G-dulverton-006D000000MJrGs,Towards training costs,Towards training costs,2006-07-26T00:00:00+00:00,1500.0,GB-COH-07991677,The Dulverton Trust,0.0291548618615
360G-dulverton-006D000000MJrY0,training costs,training costs,2011-02-08T00:00:00+00:00,2500.0,GB-COH-07991677,The Dulverton Trust,0.0291548618615
360G-LBFEW-76518,Grant to Middlesbrough 1st,the costs of the Co-Trainer/Facilitation Training Programme,2010-04-22,2600.0,GB-CHC-327114,Lloyds Bank Foundation for England and Wales,0.0291548618615
360G-RobertsonTrust-006b000000D2PZdAAN,The Costs of Training for Cadets,The Costs of Training for Cadets,2015-09-18T00:00:00+00:00,2000.0,GB-SC-SC002970,The Robertson Trust,0.0291548618615
360G-blf-0030004084,Provision of Equipment and Staff Training,A project by this Derbyshire Air Training Corps squadron to improve equipment and training for cadets who work toward B-TEC qualifications and Duke of Edinburgh Award projects. The grant will be used to cover volunteer staff training costs and purchase computer and projection equipment.,2008-03-17,8870.0,360G-blf,The Big Lottery Fund,0.0291471625206
360G-blf-0030034965,Training space project,"This group provide a safe and accessible venue within their community, where local people can access a range of services and advice about volunteering opportunities, health, leisure, training and employment. They will use this award to adapt a room and kit it out with IT equipment to be used for training, employment searches and skills development. They also hope to use the facilities to produce a project newsletter on which volunteers will take the lead and develop their skills.",2005-04-15,4962.0,360G-blf,The Big Lottery Fund,0.0291119063559
360G-blf-0030022984,Widening Representation and Support Project,This group will use an award to provide training sessions and support for volunteers to develop their skills and confidence.,2009-02-17,9990.0,360G-blf,The Big Lottery Fund,0.0290939392069
360G-blf-0030117026,There is no project name available for this record,"This group will set up a new under 13s football team and will also deliver training sessions in local primary schools. This grant will fund a pitch lining machine with two cases of paint, training balls, match balls, a training kit, training bibs, football equipment, winter venue hire, a first aid course and coach training.",2011-07-14,1833.0,360G-blf,The Big Lottery Fund,0.0290853030918
360G-blf-0030066738,Moving On(line),This is a project by a charity in Tower Hamlets. The group will use the funding to buy new equipment to provide a permanent IT training suite for people from the BAME community. This will allow the group to extend their services to deliver IT and employment skills training and support that will enable beneficiaries to improve their employment prospects.,2013-09-05,9950.0,360G-blf,The Big Lottery Fund,0.0290823865492
360G-blf-0031053623,Volunteer Career-path Training,This project will train volunteers to develop skills and experience to access employment opportunities.,2017-10-11,9909.0,360G-blf,The Big Lottery Fund,0.0290397132086
360G-blf-0031002267,DocVill Project,This is a project by a community organisation in Westminster. The group will use the funding to provide an accredited media training programme to young people. This will provide beneficiaries with future opportunities and skills to access training and employment.,2014-01-06,10000.0,360G-blf,The Big Lottery Fund,0.0290275176168
360G-blf-0031014610,Volunteer and training project,Not Available,2014-10-01,9800.0,360G-blf,The Big Lottery Fund,0.0289843043246
360G-dulverton-006D000000MJrAM,Towards the volunteer training programme,Towards the volunteer training programme,2005-02-03T00:00:00+00:00,2000.0,GB-COH-07991677,The Dulverton Trust,0.0289843043246
360G-CFTyneWearNland-160420,Towards Volunteer Training expenses,Towards Volunteer Training expenses,2015-09-08T00:00:00+00:00,942.0,GB-COH-02273708,Community Foundation serving Tyne & Wear and Northumberland,0.0289843043246
360G-blf-0031011368,The Cornerstone Volunteer Training Project,Not Available,2014-07-09,9300.0,360G-blf,The Big Lottery Fund,0.0289843043246
360G-RobertsonTrust-006b000000ATuJ6AAL,the volunteer training for 'Step it up Highland' project,the volunteer training for 'Step it up Highland' project,2015-03-26T00:00:00+00:00,5000.0,GB-SC-SC002970,The Robertson Trust,0.0289843043246
360G-blf-0030087407,Volunteer training,Prosiect i cynyddu cyfleusterau'r grwp.  Mae'r arian ar gyfer costau teithio a hyfforddi gwirfoddolwyr.,2006-03-21,4400.0,360G-blf,The Big Lottery Fund,0.0289843043246
360G-blf-0031011767,Fast Forward Volunteer Training Programme,Not Available,2014-07-16,8158.0,360G-blf,The Big Lottery Fund,0.0289843043246
360G-blf-0031015479,Volunteer Training Development,Not Available,2014-10-29,7057.0,360G-blf,The Big Lottery Fund,0.0289843043246
360G-blf-0031012718,Volunteer Training & Expenses,Not Available,2014-08-06,9326.0,360G-blf,The Big Lottery Fund,0.0289843043246
360G-blf-0031016952,Training and technical support for volunteer tax advisers,Not Available,2014-12-03,5119.0,360G-blf,The Big Lottery Fund,0.0289843043246
360G-blf-0031021632,Threads of Experience,"The organisation will use funding to deliver textile industry training workshops, for young NEET members of the community. This will provide beneficiaries with new skills, with the aim of assisting them into further training or gainful employment.",2015-04-29T00:00:00+00:00,9310.0,360G-blf,The Big Lottery Fund,0.0289652379946
360G-blf-0030000633,Winter Training and Committee Skills Training,Inter Priory Junior Football Club will use thier award to allow them to carry out training indoors during the winter. They will also use part of the award to do skills training for their management committee.,2007-08-29,3333.0,360G-blf,The Big Lottery Fund,0.0289308920274
360G-blf-0030050234,Youth Training for SV2G,"This is a project by a community organisation in Buckinghamshire. The group will use funding to deliver accounting, web-site management and life skills training to service users aged 13-25. This will give beneficiaries the skills and confidence to become involved with planning and delivering their own activities, encouraging more youth involvement in the running of the organisation. SAGE software, training sessions, course costs, transport, accommodation, subsistence, website training, life skills training",2011-09-15,5108.0,360G-blf,The Big Lottery Fund,0.02888688115
360G-blf-0030094946,Youth Development Training,"This project in Croydon will train representatives from various community groups in the locality in conflict resolution, leadership training and self-development. These representatives will then take their new skills and learning back to their individual groups and pass the training on.",2009-05-27,7057.0,360G-blf,The Big Lottery Fund,0.0288750005456
360G-blf-0031053150,Skills for Life Training,This project will seek to develop and pilot a course that provides skills training for women from the Charedi community This will improve their chances of securing  employment and realising their potential.,2017-09-20,9890.0,360G-blf,The Big Lottery Fund,0.0288492988639
360G-blf-0030037051,training,The award will contribute towards staff training and two peer educator residential training courses.,2005-04-21,2550.0,360G-blf,The Big Lottery Fund,0.0288477763758
360G-blf-0031008999,Carers Skills Training & Development,Not Available,2014-05-21,9790.0,360G-blf,The Big Lottery Fund,0.0288120600551
360G-blf-0030003281,Seize Training Opportunities,"This organisation will provide a series of free training sessions for volunteers and staff to improve their skills, enhance their opportunities and gain qualifications. The beneficiaries, some of who are under 16, have identified their own training needs and the group are working in partnership to offer Millennium Volunteer Awards and other accreditation.",2008-02-18,5000.0,360G-blf,The Big Lottery Fund,0.0288112645016
360G-blf-0031027780,Improved Cadet Training Equipment and Technology,"The group will use the funding to purchase new IT, radio and First Aid training equipment. This will modernise their training facilities and improving their educational and employment opportunities.",2015-10-14T00:00:00+00:00,9987.0,360G-blf,The Big Lottery Fund,0.0288042152695
360G-blf-0031035613,Counsellor and staff further CPD training,"This charity will use the funding to provide training for its counsellors. This will improve the skill set of counsellors, bring them up to date with emerging trends which impact on their beneficiaries and access training to improve the services for them and their clients.",2016-06-01T00:00:00+00:00,9180.0,360G-blf,The Big Lottery Fund,0.0287767356314
360G-blf-0031027939,Training for Life Project,The organisation will use the funding to run an on the job training project based on work experience and volunteering opportunities in local charity shops. This will provide personal development and employment skills and training for people that are long term unemployed and facing barriers to employment.,2015-10-21T00:00:00+00:00,9994.0,360G-blf,The Big Lottery Fund,0.0287556442655
360G-blf-0030015522,Training Expansion Programme,This project will deliver a training programme to 350 volunteer minibus drivers.,2009-01-20,9790.0,360G-blf,The Big Lottery Fund,0.0287247925622
360G-blf-0030007044,Volunteer Training Project,"This registered charity aims to increase knowledge, appreciation and understanding of patchwork, applique and quilting. The project will enable the guild to strategically plan for the next two years and provide training for trainers to enable them to run ten training days for the guild's existing and potential volunteers. The training will give volunteers the confidence and skills to organise events and promote the crafts amongst guild members and the general public.",2007-01-29,5320.0,360G-blf,The Big Lottery Fund,0.0287021084873
360G-blf-0030042473,Moor Tree Educational Training Programme,This conservation group will conduct a feasibility study with a view to becoming an accredited training provider and go on to provide training for staff and volunteers.,2006-07-18,4890.0,360G-blf,The Big Lottery Fund,0.0286921625566
360G-blf-0031037576,Katwalk Kimberleys fashion charity,The organisation will use the funding to purchase sewing machine equipment and provide sewing training to recovering addicts to produce fashion garments. This will develop the skills of beneficiaries and improve their employment opportunities.,2016-07-27T00:00:00+00:00,9911.0,360G-blf,The Big Lottery Fund,0.0286786837511
360G-blf-0031027694,Creggan Training Services - ABLE 4 all,"The organisation offers community based training across the Creggan area of Derry/Londonderry. They are using the grant of Â£10,000 to deliver a range of training courses to 40 local people to increase their skills and confidence.",2015-10-08T00:00:00+00:00,10000.0,360G-blf,The Big Lottery Fund,0.0286660600023
360G-blf-0031023790,A4A - BTCT - Building maintainance skills training project,"The organisation will use the funding to purchase additional IT equipment, craft and training resources to increase the groupâ€™s capacity to deliver training and support. This will enable the group to accommodate increasing requests from community groups and individuals, as well as provide a wider range of training activities and an improved management infrastructure so that activities can be delivered more efficiently and better serve the local community.",2015-06-24T00:00:00+00:00,9967.0,360G-blf,The Big Lottery Fund,0.0286311943789
360G-OCF-A466263,New Volunteers and their training,Engaging with new volunteers and training.,2017-12-06T00:00:00+00:00,1960.0,GB-CHC-1151621,Oxfordshire Community Foundation,0.028625453403
360G-blf-0030034354,There is no project name available for this record,"This group wish to use the award towards training for their volunteers. computer, volunteer training.",2004-04-23,1550.0,360G-blf,The Big Lottery Fund,0.0286117812682
360G-blf-0030045993,There is no project name available for this record,"This group provides rugby league training for girls in the local area. They will use the award to purchase equipment for training sessions, travel to matches and to provide coach training for volunteers.",2006-03-15,4740.0,360G-blf,The Big Lottery Fund,0.0285919222313
360G-blf-0030022746,Audio Equipment and Training,"This group provide opportunities for self improvement through progressive quality training in communication and leadership skills. The group will use an award to run training courses for the groups members in learning how to speak at a microphone. The group will purchase  PA system, carry case for PA system, microphone stand, transmitter and microphones to run the training courses and publicise the courses at the local voluntary centre and on the groups website.",2008-09-19,1118.0,360G-blf,The Big Lottery Fund,0.028590160126
360G-woodward:WCT917,Towards a PIPS training package ,Towards a PIPS training package for a suicide awareness and prevention programme in Belfast..,2008-01-24,2000.0,GB-CHC-299963,Woodward Charitable Trust,0.028583071705
360G-blf-0030059653,Training & Development for Local Councils,This is a project by a community organisation in Bedfordshire. The group will use the funding to purchase equipment in order to deliver training courses to enable local councillors make use of their role as community representatives. This will enable the group to improve their community through better training opportunities which will enable local councillors to help communities.,2011-05-05,1170.0,360G-blf,The Big Lottery Fund,0.0285659086976
360G-blf-0030065793,Creativity Works - Young Volunteer training course,This is a project by a registered charity in Bury. The organisation will use the funding to run a training programme for NEET's to develop and deliver training for young people and to develop an unused space to become viable for use by larger groups to give them opportunity to develop new skills and gain confidence and self esteem. This will give young people the skills and confidence to seek further training and potential employment.,2013-08-15,10000.0,360G-blf,The Big Lottery Fund,0.028465453623
360G-blf-A4E_3_010150285,specialist training,"Training will be provided for the members of the group, all of whom have learning disabilities, to help them improve their management and organisation skills.",2005-03-24,3350.0,360G-blf,The Big Lottery Fund,0.0284564885429
360G-blf-0030082811,Community Training Facilities,The project is to provide training opportunities for the community. The money is for purchasing computer equipment.,2006-02-21,5000.0,360G-blf,The Big Lottery Fund,0.0284529164097
360G-blf-0031037338,Community IT Training,"The organisation will use the funding to deliver IT training to residents which will focus on training, internet access and how to use equipment. This will enable residents to develop their IT skills so they can reduce their social isolation and improve their digital skills.",2016-07-20T00:00:00+00:00,9655.0,360G-blf,The Big Lottery Fund,0.0283989844136
360G-dulverton-006D000000MJrHc,Towards equipment and training costs,Towards equipment and training costs,2006-10-24T00:00:00+00:00,2000.0,GB-COH-07991677,The Dulverton Trust,0.0283650696005
360G-dulverton-006D000000MJrAj,Towards training and equipment costs,Towards training and equipment costs,2005-02-03T00:00:00+00:00,1500.0,GB-COH-07991677,The Dulverton Trust,0.0283650696005
360G-dulverton-006D000000MJrDT,Towards training and equipment costs,Towards training and equipment costs,2005-10-26T00:00:00+00:00,2000.0,GB-COH-07991677,The Dulverton Trust,0.0283650696005
360G-blf-0030096035,BADER,"With funding, this squadron of the Air Training Corps plan to install IT equipment and training aids to develop cadets. The new IT system means that all cadets and staff should have regular access to equipment for training and management purposes.",2009-02-24,4484.0,360G-blf,The Big Lottery Fund,0.0283645273604
360G-blf-0030066954,Development of our Training Studio,"This is a project by a community organisation in Swindon, Wiltshire. The group will use the funding to replace the unreliable electronic equipment in the training studio which is used to deliver media training. This will build capacity of the group to enable them to deliver more media training.",2013-08-29,10000.0,360G-blf,The Big Lottery Fund,0.0283573493338
360G-dulverton-006D000000MJrQs,induction training and support for new members,induction training and support for new members,2009-02-05T00:00:00+00:00,1400.0,GB-COH-07991677,The Dulverton Trust,0.0283105461163
360G-blf-0030091401,Equipment Purchase,"This is a project by an Army Cadet unit in Ipswich. The group will use funding to purchase training equipment benefiting existing and new members. This will enable staff to deliver more advanced training to cadets, which will further develop their military and social skills.",2010-08-26,6381.0,360G-blf,The Big Lottery Fund,0.0282973652467
360G-blf-0030041948,Training & Developing Fooball Referees,This referees' association will use an award to purchase IT equipment to enable them to deliver their training programme.,2006-10-13,8305.0,360G-blf,The Big Lottery Fund,0.0282568782621
360G-blf-0030018670,Life Skills Training,A project by this charity in Wembley to run a Life Skills Training programme for refugee families who are unable to access mainstream training programmes due to cultural and language barriers.,2009-09-11,10000.0,360G-blf,The Big Lottery Fund,0.0282418793761
360G-blf-0031030269,Deaf Awareness Training for volunteers,The group will use the funding to provide awareness training courses for their volunteers to bring them up to date with the new developments in the area of hearing and sight loss. This will make them confident in their knowledge and skills and give them the ability to deliver effective training.,2016-01-06T00:00:00+00:00,2210.0,360G-blf,The Big Lottery Fund,0.0281738141408
360G-CFTyneWearNland-170835,Towards Training sessions in IT use,Towards Training sessions in IT use,2016-10-13T00:00:00+00:00,4986.0,GB-COH-02273708,Community Foundation serving Tyne & Wear and Northumberland,0.0281681712185
360G-blf-0030043812,Training Suite,This Air Training Corps will build a training suite which will enable cadets to gain access to computers.,2006-11-16,4860.0,360G-blf,The Big Lottery Fund,0.0281676235692
360G-woodward:WCT1822,Towards the costs of training volunteers,Towards the costs of training volunteers.,2015-02-09,1000.0,GB-CHC-299963,Woodward Charitable Trust,0.0281601130897
360G-blf-0030110622,There is no project name available for this record,"The academy will purchase sports equipment for their new girls football team. This grant will fund football strips, rain jackets, training bibs, training footballs, match footballs, training kickboards, training poles and junior mannequins.",2012-06-28,2000.0,360G-blf,The Big Lottery Fund,0.0281355010409
360G-blf-0031018562,NBA Computer and Community Training Skills Development,Not Available,2015-01-28,9916.0,360G-blf,The Big Lottery Fund,0.0281212264652
360G-blf-0031003859,People and Wildlife,"The project will benefit people in the areas of north Torfaen and Blaenau Gwent east, engaging families and young NEET people (not in education, employment or training) with their local environment. Training and events will offer work placements and training to enable them to progress into education, training or employment. This three year grant will fund an existing team of four project staff, the costs of volunteers, training, evaluation, marketing, expenses and overheads.",2014-01-30,365194.0,360G-blf,The Big Lottery Fund,0.0280837754527
360G-dulverton-006D000000MJrFN,Towards training courses for volunteers,Towards training courses for volunteers,2006-05-11T00:00:00+00:00,2000.0,GB-COH-07991677,The Dulverton Trust,0.028083768705
360G-blf-0031011178,Cathedral of Hope Training Services,Not Available,2014-07-09,10000.0,360G-blf,The Big Lottery Fund,0.0280814860687
360G-blf-0030034449,training equipment,"Purchasing professional equipment for training, electronic communication, computer skills and access to the internet will enable this group to enhance the quality of their training to young people. They will run more courses and  be able to teach more cadets.",2005-07-14,4210.0,360G-blf,The Big Lottery Fund,0.0280142382137
360G-blf-0030011335,Training Sessions,This Camden-based project will deliver half-day training sessions in sewing for Sudanese parents to develop skills for life and employment.,2007-03-15,5350.0,360G-blf,The Big Lottery Fund,0.0280096917195
360G-LloydsRegisterFdn-G0102,Maritime officer cadet training,"Training for three cadets at the UK's maritime training colleges, over the three years of their course",2015-10-05T00:00:00+00:00,108000.0,GB-CHC-1145988,Lloyd's Register Foundation,0.0280094291824
360G-woodward:WCT1849,Towards the Life Skills Training Programme in Norfolk ,Towards the Life Skills Training Programme for young people with learning difficulties in Norfolk.,2015-02-09,500.0,GB-CHC-299963,Woodward Charitable Trust,0.028004788485
360G-blf-0031049630,Gower Training Weekend,"West Glamorgan Girl Guides – Gower Division will use the grant to provide leader training for 50 of their members to improve their skills and those of the Guides in their division. This grant for £2,500 will fund training fees.",2017-05-29,2500.0,360G-blf,The Big Lottery Fund,0.0279944922031
360G-blf-0030015383,Adult Leader Training,"This branch of Girlguiding UK will use the award to purchase additional training resources. The computer equipment that the group currently have is in constant demand, and so the additional resources will increase training capacity. This project will improve the quality of training sessions that will be delivered to members.",2009-01-19,1591.0,360G-blf,The Big Lottery Fund,0.0279720284368
360G-blf-LGD_1_010171882,Training equipment,This club provides football for members in the area regardless of ability and age. The award will provide a new range of training equipment to improve existing training sessions.,2005-06-28,500.0,360G-blf,The Big Lottery Fund,0.0278743221973
